{
  "suite": "rcp/methods/approvals.answer",
  "version": 1,
  "source": "Scaffolded for P0-A1",
  "notes": "approvals.answer request/response",
  "cases": [
    {
      "name": "placeholder scaffold valid baseline",
      "input": {
        "status": "scaffold"
      },
      "expect": {
        "ok": true
      }
    }
  ]
}