{
  "suite": "rcp/methods/sessions.tooloutput",
  "version": 1,
  "source": "Authored deterministic examples in packages/protocol/scripts/gen-rcp-vectors.mjs from RCP/1 and existing TS schemas; not captured implementation output; execution/independent verification deferred.",
  "notes": "input.direction chooses params/result/item/error; value is the actual JSON payload. expect is the decoded payload; error labels invalid_params/invalid_result/invalid_item/invalid_error are corpus validation categories, not host execution results. No approval digest/signature validity, policy enforcement, or exactly-once effects are claimed. Method name comes from the filename; suite labels are lowercase to satisfy the existing vector-file schema.",
  "cases": [
    {
      "name": "valid request parameters",
      "input": {
        "direction": "params",
        "value": {
          "sessionId": "session-vector-1",
          "callId": "call-1",
          "offset": 0,
          "limit": 1024
        }
      },
      "expect": {
        "sessionId": "session-vector-1",
        "callId": "call-1",
        "offset": 0,
        "limit": 1024
      }
    },
    {
      "name": "valid response payload",
      "input": {
        "direction": "result",
        "value": {
          "text": "clean\n",
          "offset": 0,
          "total": 6,
          "eof": true
        }
      },
      "expect": {
        "text": "clean\n",
        "offset": 0,
        "total": 6,
        "eof": true
      }
    },
    {
      "name": "malformed request parameters",
      "input": {
        "direction": "params",
        "value": {
          "sessionId": "session-vector-1",
          "callId": "",
          "offset": 0
        }
      },
      "error": "invalid_params"
    },
    {
      "name": "malformed response payload",
      "input": {
        "direction": "result",
        "value": {}
      },
      "error": "invalid_result"
    },
    {
      "name": "not found error payload",
      "input": {
        "direction": "error",
        "value": {
          "code": "not_found",
          "message": "Requested resource is unavailable."
        }
      },
      "expect": {
        "code": "not_found",
        "message": "Requested resource is unavailable."
      }
    }
  ]
}
