{
  "suite": "rcp/methods/hello",
  "version": 1,
  "source": "Authored deterministic examples in packages/protocol/scripts/gen-rcp-vectors.mjs from RCP/1 and existing TS schemas; not captured implementation output; execution/independent verification deferred.",
  "notes": "input.direction chooses params/result/item/error; value is the actual JSON payload. expect is the decoded payload; error labels invalid_params/invalid_result/invalid_item/invalid_error are corpus validation categories, not host execution results. No approval digest/signature validity, policy enforcement, or exactly-once effects are claimed. Method name comes from the filename; suite labels are lowercase to satisfy the existing vector-file schema.",
  "cases": [
    {
      "name": "valid request parameters",
      "input": {
        "direction": "params",
        "value": {
          "rcp": [
            1
          ],
          "app": {
            "name": "remora-android",
            "version": "1.0.0",
            "build": 7
          }
        }
      },
      "expect": {
        "rcp": [
          1
        ],
        "app": {
          "name": "remora-android",
          "version": "1.0.0",
          "build": 7
        }
      }
    },
    {
      "name": "valid response payload",
      "input": {
        "direction": "result",
        "value": {
          "rcp": 1,
          "host": {
            "id": "h_aaaaaaaaaaaaaaaaaaaaaaaaaa",
            "name": "Vector host",
            "os": "win32",
            "pathSeparator": "\\",
            "versions": {
              "remora": "1.0.0",
              "dsh": "0.1.5-rc.3"
            }
          },
          "features": [
            "sessions",
            "interaction",
            "workspaces",
            "files",
            "diffs.git",
            "notify",
            "models"
          ],
          "roots": [
            "C:\\Projects\\remora"
          ],
          "policy": {
            "approvalBiometric": "high",
            "allowRemoteSessionStart": true
          },
          "limits": {
            "maxMessageBytes": 49152,
            "maxStreams": 10
          },
          "time": 1791158400000
        }
      },
      "expect": {
        "rcp": 1,
        "host": {
          "id": "h_aaaaaaaaaaaaaaaaaaaaaaaaaa",
          "name": "Vector host",
          "os": "win32",
          "pathSeparator": "\\",
          "versions": {
            "remora": "1.0.0",
            "dsh": "0.1.5-rc.3"
          }
        },
        "features": [
          "sessions",
          "interaction",
          "workspaces",
          "files",
          "diffs.git",
          "notify",
          "models"
        ],
        "roots": [
          "C:\\Projects\\remora"
        ],
        "policy": {
          "approvalBiometric": "high",
          "allowRemoteSessionStart": true
        },
        "limits": {
          "maxMessageBytes": 49152,
          "maxStreams": 10
        },
        "time": 1791158400000
      }
    },
    {
      "name": "malformed request parameters",
      "input": {
        "direction": "params",
        "value": {
          "rcp": "1",
          "app": {
            "name": "remora-android",
            "version": "1.0.0"
          }
        }
      },
      "error": "invalid_params"
    },
    {
      "name": "malformed response payload",
      "input": {
        "direction": "result",
        "value": {}
      },
      "error": "invalid_result"
    },
    {
      "name": "not found error payload",
      "input": {
        "direction": "error",
        "value": {
          "code": "not_found",
          "message": "Requested resource is unavailable."
        }
      },
      "expect": {
        "code": "not_found",
        "message": "Requested resource is unavailable."
      }
    }
  ]
}
